{
  "$schema": "../schemas/blog-article.schema.json",
  "published": true,
  "slug": "how-to-lead-a-meeting",
  "title": "How to Lead a Meeting: Agenda, Decisions, and Follow-Through",
  "shortName": "How to Lead a Meeting",
  "category": "Interview & Meeting Preparation",
  "date": "2026-08-09",
  "dateDisplay": "August 9, 2026",
  "modified": "2026-08-09",
  "keywords": ["how to lead a meeting", "how to facilitate a meeting", "meeting agenda and follow-up", "effective meeting leadership"],
  "mentions": ["meeting facilitation", "meeting agenda", "decision making", "action items"],
  "author": { "type": "Organization", "name": "The SolPrompter Team", "url": "/about" },
  "review": { "by": "the SolPrompter team", "updatedDisplay": "August 9, 2026" },
  "seo": {
    "title": "How to Lead a Meeting: Agenda, Decisions, and Follow-Through",
    "description": "Lead an effective meeting with a purpose-led agenda, inclusive participation, clear decisions, owned action items, and a useful written follow-up.",
    "image": "https://solprompter.com/media/blog/how-to-lead-a-meeting/hero.webp"
  },
  "hero": {
    "src": "/media/blog/how-to-lead-a-meeting/hero.webp",
    "alt": "Meeting facilitator guiding a team discussion around a conference table",
    "width": 1672,
    "height": 941
  },
  "cta": { "label": "Open SolPrompter", "url": "/" },
  "content": [
    { "type": "paragraph", "html": "Lead a meeting by designing it around a specific outcome, guiding the group through the right discussion, and leaving with decisions and owned next steps. The leader’s job is not to speak most. It is to make the purpose, process, participation, and follow-up clear enough that the group can make progress." },
    { "type": "paragraph", "html": "This guide is for the organizer, chair, or facilitator. It covers the meeting lifecycle: whether to convene, how to build an agenda, how to manage discussion and decisions, and how to follow up. If you are attending rather than running the meeting, use <a href=\"/blog/interview-meeting-preparation/how-to-prepare-for-a-meeting/\">How to Prepare for a Meeting</a> for a participant-focused workflow." },
    { "type": "toc", "title": "In this guide" },
    { "type": "heading", "level": 2, "text": "Decide whether a meeting is the right tool" },
    { "type": "paragraph", "html": "Call a meeting when real-time interaction is needed to make a decision, resolve a trade-off, generate options, coordinate dependencies, or build shared understanding that cannot be achieved cleanly in writing. Send an update asynchronously when people only need information. Fewer, better-defined meetings protect attention and make attendance more meaningful." },
    { "type": "paragraph", "html": "Write one sentence that completes: “By the end of this meeting, we will…” Use a result that can be observed: choose a direction, agree on a plan, identify the top risks, or assign a next owner. Avoid outcomes such as “discuss the project.” The University of Minnesota advises planning an agenda around purpose, the outcomes for each topic, the information needed, who will decide, and how the decision will be made. <a href=\"https://extension.umn.edu/leadership-and-civic-engagement/planning-effective-meeting-agenda\">Read its planning guidance</a>." },
    { "type": "heading", "level": 2, "text": "Build an agenda that tells people how to prepare" },
    { "type": "paragraph", "html": "An agenda is a working design, not a list of talking points. Give every item an outcome, a process, a lead, and a realistic time box. Put the decisions and difficult discussions early, when attention is strongest. Send the agenda and required pre-work early enough for participants to prepare, and tell them exactly what kind of input is needed." },
    { "type": "list", "style": "principles", "items": [
      { "title": "Purpose", "text": "State the meeting’s result in plain language at the top of the invitation." },
      { "title": "Item outcome", "text": "Label each item “inform,” “generate options,” “decide,” or another observable result—not just a subject heading." },
      { "title": "Method", "text": "Choose how the group will work: a brief framing, silent review, round-robin, paired discussion, vote, or decision by a named owner." },
      { "title": "Roles", "text": "Name the facilitator, topic leads, note taker, and decision maker when they are not the same person." },
      { "title": "Time", "text": "Use time boxes as a promise about priority. If the agenda cannot fit, reduce scope before the meeting rather than hoping to rush." }
    ] },
    { "type": "paragraph", "html": "MIT’s agenda template includes desired outcome, priority, time, who, and how—useful fields because they force a leader to make the meeting design visible. <a href=\"https://hr.mit.edu/learning-topics/meetings/articles/agendas\">See the MIT example</a>. The University of Pennsylvania also recommends making the topic goal, lead, and duration explicit and ending with who, what, and when for follow-up. <a href=\"https://web.sas.upenn.edu/sasc-pmt/agenda-template/\">See its agenda template</a>." },
    { "type": "heading", "level": 2, "text": "Set roles and decision rules before discussion starts" },
    { "type": "paragraph", "html": "Confusion about authority is one of the fastest ways to create a meeting that feels productive but produces no decision. Before the first substantive item, say who is facilitating, who records decisions and actions, who has the final call, and whether the group is advising, seeking consensus, or voting. If a formal body has governing rules, conflict-of-interest, quorum, notice, or voting requirements, follow those rules rather than treating this guide as legal procedure." },
    { "type": "quote", "text": "“Today we need a recommendation on the launch sequence. I will facilitate; Priya will capture decisions and actions; Morgan is the decision owner. We will hear the options, test them against the agreed criteria, and Morgan will decide before we close.”" },
    { "type": "paragraph", "html": "Use a visible decision record for consequential choices: the decision, why it was made, the owner, and any condition that would reopen it. This prevents a later summary from turning a tentative idea into an agreed commitment." },
    { "type": "heading", "level": 2, "text": "Facilitate participation without losing the outcome" },
    { "type": "paragraph", "html": "Open by restating the purpose, reviewing the agenda, and explaining how people can participate. Frame each item with the question to answer and the information needed. Then listen for understanding, not merely airtime: summarize points fairly, invite relevant perspectives, and keep the group on the current question. The Community Tool Box describes core facilitator work as agreeing on agenda and rules, keeping discussion on track, watching time, summarizing, and encouraging participation. <a href=\"https://ctb.ku.edu/en/table-of-contents/leadership/group-facilitation/tools\">Read its effective-meeting tools</a>." },
    { "type": "list", "style": "bullets", "items": [
      { "text": "Ask for focused input: “What risk would make this option fail?” is easier to answer than “Any thoughts?”" },
      { "text": "Give people thinking time before asking for comments, especially for complex or sensitive decisions." },
      { "text": "Invite voices by role or expertise rather than putting an unprepared person on the spot." },
      { "text": "Interrupt monopolizing constructively: summarize the point, then ask for a perspective that has not been heard." },
      { "text": "Use a parking lot for valid issues that do not serve the current outcome; assign a path for each parked item." }
    ] },
    { "type": "paragraph", "html": "Participation does not require unlimited discussion. Choose the process to match the item. A complex choice may need silent reading, individual reactions, criteria comparison, and a decision. A simple coordination item may need a two-minute update and one clear commitment. The University of Minnesota recommends intentionally planning participation strategies for each topic rather than leaving engagement to chance. <a href=\"https://extension.umn.edu/leadership-and-civic-engagement/planning-effective-meeting-agenda\">Its agenda-planning guide</a> gives examples." },
    { "type": "heading", "level": 2, "text": "Manage time and scope in the moment" },
    { "type": "paragraph", "html": "Use the clock to protect the meeting’s purpose, not to cut off useful thinking arbitrarily. At the end of a time box, name the state of the item: ready to decide, needs a final question, or needs more work. Then choose deliberately—extend with the group’s agreement, assign a smaller follow-up, defer the item, or remove a lower-priority topic. Do not let a discussion run long by default and silently sacrifice a later decision." },
    { "type": "paragraph", "html": "When the group is stuck, restate the decision and criteria. Ask what information is missing, whether the decision owner has enough to choose, and what is the smallest responsible next step. A decision need not mean perfect certainty; it does require clarity about what was chosen and why." },
    { "type": "heading", "level": 2, "text": "Close every item with a decision, action, or explicit next step" },
    { "type": "paragraph", "html": "Near the end of each substantive item, summarize out loud: what the group decided, what remains open, and who will do what by when. A meeting record should distinguish these categories. West Dunbartonshire Council’s minutes guidance calls for the agenda item, what discussion, decision, and actions were agreed, including who is responsible. <a href=\"https://www.west-dunbarton.gov.uk/housing/council-housing/tenant-participation/tenants-residents-groups/taking-a-minute-of-your-meeting\">See the minutes guidance</a>." },
    { "type": "list", "style": "principles", "items": [